Welcome to Data Base -----------------------------

--------------------UC1---------------------------------
mysql> show databases;
+--------------------+
| Database           |
+--------------------+
| information_schema |
| mysql              |
| payroll_service    |
| performance_schema |
| sys                |
+--------------------+
5 rows in set (0.36 sec)

mysql> USE payroll_service;
Database changed
mysql> SELECT DATABASE();
+-----------------+
| DATABASE()      |
+-----------------+
| payroll_service |
+-----------------+
1 row in set (0.00 sec)

---------------------------UC2----------------------------------------

mysql> CREATE TABLE employee_payroll
    -> (
    -> id INT unsigned NOT NULL AUTO_INCREMENT,
    -> name VARCHAR(150) NOT NULL,
    -> salary Double NOT NULL,
    -> start DATE NOT NULL,
    -> PRIMARY key (id)
    -> );
Query OK, 0 rows affected (2.50 sec)

mysql> describe employee_payroll;
+--------+--------------+------+-----+---------+----------------+
| Field  | Type         | Null | Key | Default | Extra          |
+--------+--------------+------+-----+---------+----------------+
| id     | int unsigned | NO   | PRI | NULL    | auto_increment |
| name   | varchar(150) | NO   |     | NULL    |                |
| salary | double       | NO   |     | NULL    |                |
| start  | date         | NO   |     | NULL    |                |
+--------+--------------+------+-----+---------+----------------+
4 rows in set (0.16 sec)

---------------------------------UC3-------------------------------

mysql> insert into employee_payroll ( name, salary, start) VALUES
    -> ('BILL', 10000000.00, '2018-01-03'),
    -> ('Terisa', 2000000.00, '2019-11-12' ),
    -> ('Charlie', 3000000.00, '2020-05-21' );
Query OK, 3 rows affected (0.25 sec)
Records: 3  Duplicates: 0  Warnings: 0

----------------------------------UC4-----------------------------

mysql> Select * from employee_payroll;
+----+---------+----------+------------+
| id | name    | salary   | start      |
+----+---------+----------+------------+
|  1 | BILL    | 10000000 | 2018-01-03 |
|  2 | Terisa  |  2000000 | 2019-11-12 |
|  3 | Charlie |  3000000 | 2020-05-21 |
+----+---------+----------+------------+
3 rows in set (0.04 sec)

----------------------------------UC5-------------------------------

mysql> select * from employee_payroll
    -> where start BETWEEN CAST('2018-01-01' AS DATE) AND DATE(NOW());
+----+---------+----------+------------+
| id | name    | salary   | start      |
+----+---------+----------+------------+
|  1 | BILL    | 10000000 | 2018-01-03 |
|  2 | Terisa  |  2000000 | 2019-11-12 |
|  3 | Charlie |  3000000 | 2020-05-21 |
+----+---------+----------+------------+
3 rows in set (0.11 sec)

mysql> select * from employee_payroll
    -> where start BETWEEN CAST('2019-01-01' AS DATE) AND DATE(NOW());
+----+---------+---------+------------+
| id | name    | salary  | start      |
+----+---------+---------+------------+
|  2 | Terisa  | 2000000 | 2019-11-12 |
|  3 | Charlie | 3000000 | 2020-05-21 |
+----+---------+---------+------------+
2 rows in set (0.00 sec)

------------------------------------UC6-------------------------------

mysql> update employee_payroll set gender = 'F' where name = 'Terisa';
Query OK, 1 row affected (0.10 sec)
Rows matched: 1  Changed: 1  Warnings: 0

mysql> select * from employee_payroll;
+----+---------+--------+----------+------------+
| id | name    | gender | salary   | start      |
+----+---------+--------+----------+------------+
|  1 | BILL    | NULL   | 10000000 | 2018-01-03 |
|  2 | Terisa  | F      |  2000000 | 2019-11-12 |
|  3 | Charlie | NULL   |  3000000 | 2020-05-21 |
+----+---------+--------+----------+------------+
3 rows in set (0.04 sec)

mysql> update employee_payroll set gender = 'M' where name = 'BILL' or name = 'Charlie';
Query OK, 2 rows affected (0.14 sec)
Rows matched: 2  Changed: 2  Warnings: 0

mysql> select * from employee_payroll;
+----+---------+--------+----------+------------+
| id | name    | gender | salary   | start      |
+----+---------+--------+----------+------------+
|  1 | BILL    | M      | 10000000 | 2018-01-03 |
|  2 | Terisa  | F      |  2000000 | 2019-11-12 |
|  3 | Charlie | M      |  3000000 | 2020-05-21 |
+----+---------+--------+----------+------------+
3 rows in set (0.00 sec)

mysql> select * from employee_payroll;
+----+---------+--------+----------+------------+
| id | name    | gender | salary   | start      |
+----+---------+--------+----------+------------+
|  1 | BILL    | M      | 10000000 | 2018-01-03 |
|  2 | Terisa  | F      |  2000000 | 2019-11-12 |
|  3 | Charlie | M      |  3000000 | 2020-05-21 |
+----+---------+--------+----------+------------+
3 rows in set (0.01 sec)

------------------------------------UC7-----------------------------

mysql> update employee_payroll set salary = 3000000.00 where name = 'Terisa';
Query OK, 1 row affected (0.67 sec)
Rows matched: 1  Changed: 1  Warnings: 0

mysql> describe employee_payroll;
+--------+--------------+------+-----+---------+----------------+
| Field  | Type         | Null | Key | Default | Extra          |
+--------+--------------+------+-----+---------+----------------+
| id     | int unsigned | NO   | PRI | NULL    | auto_increment |
| name   | varchar(150) | NO   |     | NULL    |                |
| gender | char(1)      | YES  |     | NULL    |                |
| salary | double       | NO   |     | NULL    |                |
| start  | date         | NO   |     | NULL    |                |
+--------+--------------+------+-----+---------+----------------+
5 rows in set (0.13 sec)

mysql> select * from employee_payroll;
+----+---------+--------+----------+------------+
| id | name    | gender | salary   | start      |
+----+---------+--------+----------+------------+
|  1 | BILL    | M      | 10000000 | 2018-01-03 |
|  2 | Terisa  | F      |  3000000 | 2019-11-12 |
|  3 | Charlie | M      |  3000000 | 2020-05-21 |
+----+---------+--------+----------+------------+
3 rows in set (0.05 sec)

mysql> SELECT AVG(salary) FROM employee_payroll WHERE gender = 'M' GROUP BY gender;
+-------------+
| AVG(salary) |
+-------------+
|     6500000 |
+-------------+
1 row in set (0.07 sec)

mysql> SELECT gender, AVG(salary) FROM employee_payroll GROUP BY gender;
+--------+-------------+
| gender | AVG(salary) |
+--------+-------------+
| M      |     6500000 |
| F      |     3000000 |
+--------+-------------+
2 rows in set (0.04 sec)

mysql> SELECT gender, COUNT(name) FROM employee_payroll GROUP BY gender;
+--------+-------------+
| gender | COUNT(name) |
+--------+-------------+
| M      |           2 |
| F      |           1 |
+--------+-------------+
2 rows in set (0.00 sec)

mysql> SELECT gender, SUM(salary) FROM employee_payroll GROUP BY gender;
+--------+-------------+
| gender | SUM(salary) |
+--------+-------------+
| M      |    13000000 |
| F      |     3000000 |
+--------+-------------+
2 rows in set (0.00 sec)